{
  "schema_version": "1.0",
  "review_date": "2026-09-29",
  "scope": "Third-party skill repositories screened as sources of ideas (desk review, read-only, nothing installed). Seeded from my-10-kaizen report 08-awesome-claude-skills section 5.8 (GitHub API metadata, 29 Sep 2026). A verdict is never permission to install; fields the desk review did not establish are NOT_ASSESSED.",
  "procedure": "chwezi-dev-engine/skills/sdlc-meta/skill-engine-audit/references/ecosystem-scan-and-intake.md",
  "entries": [
    {
      "component": "omkamal/pypict-claude-skill",
      "url": "https://github.com/omkamal/pypict-claude-skill",
      "commit": "NOT_ASSESSED",
      "license_spdx": "MIT",
      "stars_at_review": 99,
      "last_push": "2026-03-22",
      "archived": "NOT_ASSESSED",
      "scripts_present": true,
      "network_behavior": "NOT_ASSESSED",
      "credential_asks": "NOT_ASSESSED",
      "install_method": "NOT_ASSESSED",
      "vendored_copy_of": null,
      "overlap_paths": [
        "srs-skills/05-testing-documentation/02-test-plan (lists other techniques; no pairwise)"
      ],
      "verdict": "borrow_idea",
      "reason": "Pairwise (PICT) test design is absent from the engines; paraphrase into an SRS reference (AC-05). The licence file says MIT; the GitHub API reports NOASSERTION.",
      "reviewed_on": "2026-09-29",
      "review_after": "2026-12-29",
      "reviewer": "M10-04 executor under Peter's delegated authority (desk review from my-10-kaizen report 08, section 5.8)"
    },
    {
      "component": "anthropics/skills mcp-builder",
      "url": "https://github.com/anthropics/skills",
      "commit": "fa0fa64",
      "license_spdx": "Apache-2.0",
      "stars_at_review": "NOT_ASSESSED",
      "last_push": "2026-07-17",
      "archived": "NOT_ASSESSED",
      "scripts_present": "NOT_ASSESSED",
      "network_behavior": "NOT_ASSESSED",
      "credential_asks": "NOT_ASSESSED",
      "install_method": "NOT_ASSESSED",
      "vendored_copy_of": "Diverged copy in ComposioHQ/awesome-claude-skills; upstream is canonical",
      "overlap_paths": [
        "chwezi-dev-engine/skills/ai/ai-agent-tooling-and-hitl (MCP security covered; usability eval absent)"
      ],
      "verdict": "borrow_idea",
      "reason": "MCP tool-surface usability evaluation (AC-06). Cite upstream anthropics/skills at a commit, never the diverged copy in ComposioHQ/awesome-claude-skills. last_push is the upstream commit date recorded in the report.",
      "reviewed_on": "2026-09-29",
      "review_after": "2026-12-29",
      "reviewer": "M10-04 executor under Peter's delegated authority (desk review from my-10-kaizen report 08, section 5.8)"
    },
    {
      "component": "lackeyjb/playwright-skill",
      "url": "https://github.com/lackeyjb/playwright-skill",
      "commit": "NOT_ASSESSED",
      "license_spdx": "MIT",
      "stars_at_review": 3154,
      "last_push": "2026-08-14",
      "archived": "NOT_ASSESSED",
      "scripts_present": "NOT_ASSESSED",
      "network_behavior": "NOT_ASSESSED",
      "credential_asks": "NOT_ASSESSED",
      "install_method": "NOT_ASSESSED",
      "vendored_copy_of": null,
      "overlap_paths": [
        "website-skills visual-qa guidance",
        "design-system-skills ui-demo"
      ],
      "verdict": "borrow_idea",
      "reason": "Dev-server detection and a never-report-success-without-inspecting step for website visual QA (AC-10).",
      "reviewed_on": "2026-09-29",
      "review_after": "2026-12-29",
      "reviewer": "M10-04 executor under Peter's delegated authority (desk review from my-10-kaizen report 08, section 5.8)"
    },
    {
      "component": "uxKero/anydesign",
      "url": "https://github.com/uxKero/anydesign",
      "commit": "NOT_ASSESSED",
      "license_spdx": "MIT",
      "stars_at_review": 201,
      "last_push": "2026-09-15",
      "archived": "NOT_ASSESSED",
      "scripts_present": true,
      "network_behavior": "NOT_ASSESSED",
      "credential_asks": "NOT_ASSESSED",
      "install_method": "NOT_ASSESSED",
      "vendored_copy_of": null,
      "overlap_paths": [
        "design-system-skills/skills/09-design-systems-tokens-and-theming/measured-style-pack"
      ],
      "verdict": "borrow_idea",
      "reason": "Capture budget and element-scope mode for measured-style-pack (AC-08); the human-authority gate is unchanged.",
      "reviewed_on": "2026-09-29",
      "review_after": "2026-12-29",
      "reviewer": "M10-04 executor under Peter's delegated authority (desk review from my-10-kaizen report 08, section 5.8)"
    },
    {
      "component": "rampstackco/claude-skills",
      "url": "https://github.com/rampstackco/claude-skills",
      "commit": "NOT_ASSESSED",
      "license_spdx": "MIT",
      "stars_at_review": 913,
      "last_push": "2026-09-15",
      "archived": "NOT_ASSESSED",
      "scripts_present": "NOT_ASSESSED",
      "network_behavior": "NOT_ASSESSED",
      "credential_asks": "NOT_ASSESSED",
      "install_method": "NOT_ASSESSED",
      "vendored_copy_of": null,
      "overlap_paths": [
        "website-skills",
        "social-media-skills",
        "design-system-skills"
      ],
      "verdict": "study",
      "reason": "Heavy overlap; study only its SKILLS.lock hash file and authoring contract.",
      "reviewed_on": "2026-09-29",
      "review_after": "2026-12-29",
      "reviewer": "M10-04 executor under Peter's delegated authority (desk review from my-10-kaizen report 08, section 5.8)"
    },
    {
      "component": "anthropics/skills webapp-testing",
      "url": "https://github.com/anthropics/skills",
      "commit": "fa0fa64",
      "license_spdx": "Apache-2.0",
      "stars_at_review": "NOT_ASSESSED",
      "last_push": "2026-07-17",
      "archived": "NOT_ASSESSED",
      "scripts_present": true,
      "network_behavior": "NOT_ASSESSED",
      "credential_asks": "NOT_ASSESSED",
      "install_method": "NOT_ASSESSED",
      "vendored_copy_of": "Identical copy in ComposioHQ/awesome-claude-skills",
      "overlap_paths": [
        "website-skills visual-qa guidance",
        "design-system-skills ui-demo"
      ],
      "verdict": "study",
      "reason": "Server-lifecycle helper; study alongside playwright-skill. The awesome-list copy is blob-identical to upstream.",
      "reviewed_on": "2026-09-29",
      "review_after": "2026-12-29",
      "reviewer": "M10-04 executor under Peter's delegated authority (desk review from my-10-kaizen report 08, section 5.8)"
    },
    {
      "component": "Wholiver/swiftui-design-skill",
      "url": "https://github.com/Wholiver/swiftui-design-skill",
      "commit": "NOT_ASSESSED",
      "license_spdx": "MIT",
      "stars_at_review": 205,
      "last_push": "2026-05-01",
      "archived": "NOT_ASSESSED",
      "scripts_present": "NOT_ASSESSED",
      "network_behavior": "NOT_ASSESSED",
      "credential_asks": "NOT_ASSESSED",
      "install_method": "NOT_ASSESSED",
      "vendored_copy_of": null,
      "overlap_paths": [
        "design-system-skills group 07 (mobile)",
        "design-system-skills slop audits"
      ],
      "verdict": "study",
      "reason": "AI-authored heuristics: evidence for bans only, never design authority.",
      "reviewed_on": "2026-09-29",
      "review_after": "2026-12-29",
      "reviewer": "M10-04 executor under Peter's delegated authority (desk review from my-10-kaizen report 08, section 5.8)"
    },
    {
      "component": "sanjay3290/ai-skills (postgres)",
      "url": "https://github.com/sanjay3290/ai-skills",
      "commit": "NOT_ASSESSED",
      "license_spdx": "Apache-2.0",
      "stars_at_review": 428,
      "last_push": "2026-09-10",
      "archived": "NOT_ASSESSED",
      "scripts_present": "NOT_ASSESSED",
      "network_behavior": "NOT_ASSESSED",
      "credential_asks": "NOT_ASSESSED",
      "install_method": "NOT_ASSESSED",
      "vendored_copy_of": null,
      "overlap_paths": [
        "chwezi-dev-engine/skills/backend-databases/postgresql-engineering"
      ],
      "verdict": "study",
      "reason": "Compare its read-only SQL guard with the AI-tooling least-privilege reference.",
      "reviewed_on": "2026-09-29",
      "review_after": "2026-12-29",
      "reviewer": "M10-04 executor under Peter's delegated authority (desk review from my-10-kaizen report 08, section 5.8)"
    },
    {
      "component": "yusufkaraaslan/Skill_Seekers",
      "url": "https://github.com/yusufkaraaslan/Skill_Seekers",
      "commit": "NOT_ASSESSED",
      "license_spdx": "MIT",
      "stars_at_review": 15042,
      "last_push": "2026-09-20",
      "archived": "NOT_ASSESSED",
      "scripts_present": "NOT_ASSESSED",
      "network_behavior": "NOT_ASSESSED",
      "credential_asks": "NOT_ASSESSED",
      "install_method": "NOT_ASSESSED",
      "vendored_copy_of": null,
      "overlap_paths": [
        "digital-research-engine knowledge-productization"
      ],
      "verdict": "ignore",
      "reason": "Converts PDFs, books and sites into skills; conflicts with the no-book-extractions rule.",
      "reviewed_on": "2026-09-29",
      "review_after": "2026-12-29",
      "reviewer": "M10-04 executor under Peter's delegated authority (desk review from my-10-kaizen report 08, section 5.8)"
    },
    {
      "component": "NeoLabHQ/context-engineering-kit",
      "url": "https://github.com/NeoLabHQ/context-engineering-kit",
      "commit": "NOT_ASSESSED",
      "license_spdx": "GPL-3.0",
      "stars_at_review": 1734,
      "last_push": "NOT_ASSESSED",
      "archived": "NOT_ASSESSED",
      "scripts_present": "NOT_ASSESSED",
      "network_behavior": "NOT_ASSESSED",
      "credential_asks": "NOT_ASSESSED",
      "install_method": "NOT_ASSESSED",
      "vendored_copy_of": null,
      "overlap_paths": [
        "kaizen-improvement-system",
        "ai-prompt-engineering"
      ],
      "verdict": "ignore",
      "reason": "Copyleft licence is incompatible with the MIT engines; the ideas are already held.",
      "reviewed_on": "2026-09-29",